{
  "swearingIn": "2026-05-08",
  "deadline100": "2026-08-16",
  "lastUpdated": "2026-05-09",
  "categories": [
    { "id": "agriculture", "label": "Agriculture & Farmers",   "icon": "🌾", "num": "I" },
    { "id": "welfare",     "label": "Welfare & Social",        "icon": "🏥", "num": "II" },
    { "id": "justice",     "label": "Accountability & Justice","icon": "⚖️", "num": "III" },
    { "id": "employment",  "label": "Employment & Industry",   "icon": "🏭", "num": "IV" },
    { "id": "infra",       "label": "Infrastructure & Housing","icon": "🏗️", "num": "V" }
  ],
  "pledges": [
    {
      "id": "paddy",
      "category": "agriculture",
      "title": "Direct Paddy Procurement at MSP",
      "detail": "BJP promised to procure paddy directly from farmers at the Central MSP (₹2,183/quintal for common paddy, FY26) through government agencies, eliminating middlemen and the APMC commission agent layer that depressed farmer receipts under TMC.",
      "source": "BJP 2026 Manifesto (Agriculture chapter)",
      "status": "watching",
      "deadlineLabel": "100 days",
      "deadlineDate": "2026-08-16",
      "updateNote": "No government order issued yet.",
      "newsHeadline": null,
      "newsDate": null,
      "newsUrl": null,
      "keywords": ["BJP Bengal paddy MSP 2026", "West Bengal paddy procurement MSP government"]
    },
    {
      "id": "kisan",
      "category": "agriculture",
      "title": "₹6,000/Year Kisan Samman Supplement",
      "detail": "BJP pledged to supplement the Central PM-KISAN ₹6,000/year with a matching state contribution, bringing total direct benefit transfers to enrolled farmers to ₹12,000/year — a doubling of the existing Central scheme.",
      "source": "BJP 2026 Manifesto (Agriculture chapter)",
      "status": "watching",
      "deadlineLabel": "30 days",
      "deadlineDate": "2026-06-07",
      "updateNote": "No government order issued yet.",
      "newsHeadline": null,
      "newsDate": null,
      "newsUrl": null,
      "keywords": ["BJP Bengal Kisan Samman supplement 2026", "West Bengal PM KISAN state supplement"]
    },
    {
      "id": "irrigation",
      "category": "agriculture",
      "title": "Irrigation Canal Restoration — North Bengal",
      "detail": "Restore and desilt the Teesta Barrage distribution canals in Jalpaiguri and Cooch Behar — neglected under TMC — to expand irrigation coverage for 3 lakh acres of agricultural land ahead of the kharif season.",
      "source": "BJP 2026 manifesto supplement, North Bengal",
      "status": "watching",
      "deadlineLabel": "100 days",
      "deadlineDate": "2026-08-16",
      "updateNote": "No government order issued yet.",
      "newsHeadline": null,
      "newsDate": null,
      "newsUrl": null,
      "keywords": ["Teesta canal restoration Bengal BJP 2026", "West Bengal irrigation canal Jalpaiguri 2026"]
    },
    {
      "id": "pmfby",
      "category": "agriculture",
      "title": "PM Fasal Bima Yojana — Full State Enrollment",
      "detail": "BJP pledged to enroll all eligible farmers in the Central crop insurance scheme PMFBY within 100 days — TMC had refused to implement it for over a decade, leaving Bengal's 70 lakh farming households without coverage during floods and cyclones. Target: 80 lakh enrollments.",
      "source": "BJP 2026 Manifesto (Agriculture chapter)",
      "status": "watching",
      "deadlineLabel": "100 days",
      "deadlineDate": "2026-08-16",
      "updateNote": "No enrollment drive or state notification launched.",
      "newsHeadline": null,
      "newsDate": null,
      "newsUrl": null,
      "keywords": ["PMFBY West Bengal BJP 2026 enrollment", "Bengal crop insurance Fasal Bima 2026"]
    },
    {
      "id": "jute",
      "category": "agriculture",
      "title": "Jute Direct Procurement at MSP — JCI Revival",
      "detail": "BJP pledged to revive direct jute procurement through the Jute Corporation of India at declared MSP across Nadia, North 24 Parganas, and Murshidabad — bypassing the trader nexus that suppressed prices for 40 lakh jute farmer families dependent on the crop.",
      "source": "BJP 2026 manifesto supplement, Nadia & Murshidabad",
      "status": "watching",
      "deadlineLabel": "100 days",
      "deadlineDate": "2026-08-16",
      "updateNote": "No JCI procurement circular issued by state.",
      "newsHeadline": null,
      "newsDate": null,
      "newsUrl": null,
      "keywords": ["JCI jute Bengal MSP BJP 2026", "West Bengal jute procurement 2026"]
    },
    {
      "id": "health",
      "category": "welfare",
      "title": "Swastha Saathi 2.0 — Universal Health Cover",
      "detail": "BJP pledged to expand the existing Swastha Saathi health insurance scheme and increase the annual coverage cap from ₹5 lakh to ₹10 lakh per family, while expanding the empanelled hospital network to include private hospitals in district towns.",
      "source": "BJP 2026 Manifesto (Health chapter)",
      "status": "watching",
      "deadlineLabel": "100 days",
      "deadlineDate": "2026-08-16",
      "updateNote": "No government order issued yet.",
      "newsHeadline": null,
      "newsDate": null,
      "newsUrl": null,
      "keywords": ["Swastha Saathi expansion BJP Bengal 2026", "West Bengal health insurance 10 lakh 2026"]
    },
    {
      "id": "electricity",
      "category": "welfare",
      "title": "Free Domestic Electricity — 300 Units/Month",
      "detail": "BJP's campaign promise: households consuming up to 300 units/month would pay zero electricity bills — a significant expansion of the existing Central PM-Surya Ghar rooftop solar scheme's free-unit provisions.",
      "source": "BJP 2026 campaign rallies · BJP Bengal electricity manifesto",
      "status": "watching",
      "deadlineLabel": "100 days",
      "deadlineDate": "2026-08-16",
      "updateNote": "No government order issued yet.",
      "newsHeadline": null,
      "newsDate": null,
      "newsUrl": null,
      "keywords": ["free electricity Bengal BJP 300 units 2026", "West Bengal WBSEDCL free units BJP"]
    },
    {
      "id": "bijoya",
      "category": "welfare",
      "title": "Bijoya Lakshmi — Women's Monthly Stipend",
      "detail": "BJP's answer to TMC's Lakshmir Bhandar: a renamed/restructured scheme providing ₹2,000/month to women-headed households below the poverty line, using Aadhaar-linked direct bank transfer with zero intermediaries.",
      "source": "BJP 2026 Manifesto (Welfare chapter) · BJP women's cell campaign material",
      "status": "watching",
      "deadlineLabel": "100 days",
      "deadlineDate": "2026-08-16",
      "updateNote": "No government order issued yet.",
      "newsHeadline": null,
      "newsDate": null,
      "newsUrl": null,
      "keywords": ["Bijoya Lakshmi scheme Bengal BJP 2026", "West Bengal women stipend BJP 2000"]
    },
    {
      "id": "ops",
      "category": "welfare",
      "title": "Old Pension Scheme — State Employee Restoration",
      "detail": "BJP pledged to restore the Old Pension Scheme (OPS) for West Bengal state government employees, reversing the NPS enrollment that began under TMC. A pension security committee was promised within 30 days.",
      "source": "BJP 2026 Manifesto · BJP state employees' wing campaign",
      "status": "watching",
      "deadlineLabel": "30 days (committee)",
      "deadlineDate": "2026-06-07",
      "updateNote": "No committee constituted; no notification issued.",
      "newsHeadline": null,
      "newsDate": null,
      "newsUrl": null,
      "keywords": ["Old Pension Scheme West Bengal BJP 2026", "Bengal OPS NPS reversal state employees"]
    },
    {
      "id": "pds",
      "category": "welfare",
      "title": "PDS Ration Card Audit — Eliminate Ghost Beneficiaries",
      "detail": "BJP pledged an Aadhaar-linked audit of all PDS ration cards within 100 days to eliminate duplicate and fake beneficiaries — with genuine BPL families to receive enhanced food entitlements freed by the audit savings.",
      "source": "BJP 2026 Manifesto (Food Security chapter)",
      "status": "watching",
      "deadlineLabel": "100 days",
      "deadlineDate": "2026-08-16",
      "updateNote": "No audit notification or NIC tender issued.",
      "newsHeadline": null,
      "newsDate": null,
      "newsUrl": null,
      "keywords": ["PDS ration card audit Bengal BJP 2026", "West Bengal ghost beneficiaries ration audit 2026"]
    },
    {
      "id": "syndicate",
      "category": "justice",
      "title": "Dissolve TMC Syndicate Networks — 100-Day Crackdown",
      "detail": "BJP's most-cited promise: a systematic crackdown on the \"cut money\" and \"tolly\" collection networks operated by TMC-linked syndicates in construction, sand mining, and public works — with ED and CBI referrals for documented cases.",
      "source": "BJP 2026 manifesto · Suvendu Adhikari repeated public statements",
      "status": "watching",
      "deadlineLabel": "100 days",
      "deadlineDate": "2026-08-16",
      "updateNote": "No action announced yet. Post-election violence against TMC workers reported in some districts — separate from syndicate dissolution.",
      "newsHeadline": null,
      "newsDate": null,
      "newsUrl": null,
      "keywords": ["TMC syndicate crackdown BJP Bengal 2026", "Bengal cut money syndicate arrest 2026"]
    },
    {
      "id": "ssc",
      "category": "justice",
      "title": "SSC Teacher Regularization — Court-Compliant Scheme",
      "detail": "Devise a scheme to re-employ the ~26,000 teachers dismissed under Supreme Court orders in the SSC recruitment scam — BJP promised a fresh, corruption-free recruitment process with interim employment for those who passed original written tests.",
      "source": "BJP 2026 Manifesto (Education chapter) · Supreme Court order reference",
      "status": "watching",
      "deadlineLabel": "100 days",
      "deadlineDate": "2026-08-16",
      "updateNote": "No government order issued yet. Supreme Court oversight remains active.",